{
  "general": {
    "duracion_total": "",
    "numero_interacciones": 0,
    "persona_objetivo": "",
    "flujo": "",
    "tarea": "",
    "dispositivo": ""
  },
  "hallazgos": [],
  "microcopy": [],
  "accesibilidad": {
    "contraste_ok": false,
    "foco_visible": false,
    "tap_target_ok": false,
    "labels_ok": false,
    "teclado_ok": false
  },
  "metricas_sugeridas": {
    "tasa_finalizacion": "",
    "tiempo_por_paso": "",
    "errores_frecuentes": []
  },
  "score_friccion_ux": {
    "puntuacion": 0,
    "interpretacion": "",
    "desglose": ""
  },
  "predicciones_ux": {
    "abandono_estimado": "",
    "tiempo_completitud": "",
    "satisfaccion_esperada": "",
    "quick_win_prioritario": ""
  },
  "resumen_lyra": ""
}


